{"$schema":"https://json-schema.org/draft/2020-12/schema","$id":"https://agile-v.org/schemas/GATE_RECEIPT.schema.json","title":"Gate receipt","type":"object","required":["schema_version","compatibility","migration","fixture_owner","gate_receipt"],"properties":{"schema_version":{"const":"1.1"},"compatibility":{"type":"string","minLength":1},"migration":{"type":"string","minLength":1},"fixture_owner":{"type":"string","minLength":1},"gate_receipt":{"type":"object","required":["id","task_id","gate","evaluated_at","lifecycle","subject_state","policy","claims","decision"],"properties":{"id":{"pattern":"^GATE-[A-Z0-9-]+$"},"task_id":{"type":"string","minLength":1},"correlation_id":{"type":"string"},"gate":{"enum":["gate_1","eval_gate","gate_2","qualification_stage","custom"]},"evaluated_at":{"format":"date-time"},"lifecycle":{"type":"object","required":["from_state","to_state"],"properties":{"from_state":{"type":"string","minLength":1},"to_state":{"type":"string","minLength":1}},"additionalProperties":true},"subject_state":{"type":"object","properties":{"requirement_revision_ref":{"type":"string","minLength":1},"requirement_baseline_id":{"type":"string","minLength":1},"source_commit":{"type":"string","minLength":1},"build_digest":{"pattern":"^sha256:[a-f0-9]{64}$"},"subject_digest":{"pattern":"^sha256:[a-f0-9]{64}$"}},"additionalProperties":true},"policy":{"type":"object","required":["policy_id","policy_version","policy_digest"],"properties":{"policy_id":{"type":"string","minLength":1},"policy_version":{"type":"string","minLength":1},"policy_digest":{"pattern":"^sha256:[a-f0-9]{64}$"},"control_matrix_digest":{"pattern":"^sha256:[a-f0-9]{64}$"}},"additionalProperties":true},"claims":{"type":"object","required":["required","admitted","rejected","stale"],"properties":{"required":{"type":"array","items":{"type":"string"}},"admitted":{"type":"array","items":{"type":"string"}},"rejected":{"type":"array","items":{"type":"string"}},"stale":{"type":"array","items":{"type":"string"}}},"additionalProperties":true},"obligations":{"type":"object","properties":{"open":{"type":"array","items":{"type":"string"}},"discharged":{"type":"array","items":{"type":"string"}}},"additionalProperties":true},"approvals":{"type":"array","items":{"type":"object","required":["approval_ref"],"properties":{"approval_ref":{"pattern":"^APR-[A-Z0-9-]+$"}},"additionalProperties":true}},"exception_refs":{"type":"array","items":{"pattern":"^EXC-[A-Z0-9-]+$"}},"verifier":{"type":"object","properties":{"verification_ref":{"type":"string"},"independence_class":{"enum":["I0","I1","I2","I3","I4"]}},"additionalProperties":true},"residual_risk":{"type":"object","properties":{"refs":{"type":"array","items":{"type":"string"}},"accepted_by":{"type":["string","null"]}},"additionalProperties":true},"decision":{"type":"object","required":["status"],"properties":{"status":{"enum":["PASS","WAIVED","FAIL","NEEDS_HUMAN","STALE","CONFLICT"]},"rationale_ref":{"type":"string"}},"additionalProperties":true}},"additionalProperties":true,"allOf":[{"if":{"properties":{"gate":{"const":"gate_1"}},"required":["gate"]},"then":{"properties":{"subject_state":{"required":["requirement_revision_ref"]}}}},{"if":{"properties":{"gate":{"enum":["eval_gate","gate_2","qualification_stage"]}},"required":["gate"]},"then":{"properties":{"subject_state":{"required":["requirement_baseline_id"]}}}},{"if":{"properties":{"decision":{"properties":{"status":{"const":"WAIVED"}},"required":["status"]}},"required":["decision"]},"then":{"required":["exception_refs"],"properties":{"exception_refs":{"type":"array","minItems":1}}}}]}},"additionalProperties":false}
