{
  "schema_version": "1.1",
  "compatibility": "additive",
  "migration": "none",
  "fixture_owner": "tests",
  "gate_receipt": {
    "id": "GATE-1",
    "task_id": "AAV-0042",
    "correlation_id": "COR-1",
    "gate": "gate_2",
    "evaluated_at": "2026-09-13T12:00:00Z",
    "lifecycle": {
      "from_state": "review_pending",
      "to_state": "accepted"
    },
    "policy": {
      "policy_id": "POL-1",
      "policy_version": "2.3",
      "policy_digest": "sha256:eeeeeeeeeeeeeeeeeeeeeeeeeeeeeeeeeeeeeeeeeeeeeeeeeeeeeeeeeeeeeeee",
      "control_matrix_digest": "sha256:ffffffffffffffffffffffffffffffffffffffffffffffffffffffffffffffff"
    },
    "claims": {
      "required": [
        "CLM-1"
      ],
      "admitted": [
        "CLM-1"
      ],
      "rejected": [],
      "stale": []
    },
    "obligations": {
      "open": [],
      "discharged": [
        "OBL-1"
      ]
    },
    "approvals": [
      {
        "approval_ref": "APR-1"
      }
    ],
    "verifier": {
      "verification_ref": "VER-0001",
      "independence_class": "I2"
    },
    "residual_risk": {
      "refs": [],
      "accepted_by": "owner"
    },
    "decision": {
      "status": "PASS",
      "rationale_ref": "GATE-1-RATIONALE"
    },
    "subject_state": {
      "requirement_baseline_id": "BL-1",
      "source_commit": "cccccccccccccccccccccccccccccccccccccccc",
      "build_digest": "sha256:dddddddddddddddddddddddddddddddddddddddddddddddddddddddddddddddd"
    }
  }
}
